{
  "schema_version": "triad-test.intr-envelope.v1",
  "packet_id": "master-records-to-triad-test-boundary-001",
  "direction": "INGRESS",
  "origin": {
    "org": "master-records",
    "repository": "master-records/.github",
    "service": "master-records.boundary-diagnostic",
    "runtime_instance": "org-boundary-execution"
  },
  "destination": {
    "org": "Triad-Test",
    "repository": "Triad-Test/.github",
    "service": "triad-test.boundary-diagnostic",
    "runtime_instance": "org-boundary-execution"
  },
  "carrier": {
    "kind": "HB_DERIVED",
    "reference": "HB-derived/org-boundary/master-triad-001",
    "observed_at": "2026-08-31T20:59:00Z"
  },
  "intr_profile": "stegverse.intr.org-boundary.v1",
  "transition": {
    "reference": "org-boundary-diagnostic-transition.v1",
    "authority_effect": "NONE",
    "conditions": []
  },
  "payload": {
    "kind": "BOUNDARY_DIAGNOSTIC",
    "message": "master-records to Triad-Test ingress probe",
    "reply_requested": false
  },
  "evidence": {
    "ingress_receipt": null,
    "dispatch_receipt": null,
    "consumption_receipt": null,
    "egress_receipt": null,
    "reconstruction_reference": null
  }
}
